{
  "manifestVersion": "1.0.0",
  "sourceSchemaVersion": "2.0.0",
  "buildId": "world01-shadow-forest-golden",
  "seed": 48151623,
  "runtimeVersion": "0.1.0",
  "namespace": "Workspace.Generated.world01-shadow-forest-golden",
  "artifactHashes": {
    "gameConcept": "sha256:0e14c93688ad3e5737d30598203222c01a3d273f55808f2a20869ba3df5621fb",
    "director": "sha256:3bcd33b2b860ac7e72fd11c1d7304393c09894435712fb0008df274d01e8a07f",
    "layout": "sha256:390c9b6cd1153fc54f73fe7dc2b9eb15f1230555f0bf9f94beee874c96431387",
    "terrain": "sha256:3cfe1ffd871acf2d27689be8c9e2b3dbc38343386a8a57f187a3997f458a1a57",
    "props": "sha256:81c1b9b3780a39649e5e6e617e68221448814fc9d6c087d7d88f65abfb1e5842",
    "lighting": "sha256:201202fca8b8b7e088a41659cb09b7c0884c3981ddffb67cb01e856736e20cdf",
    "economy": "sha256:797e31e226ef42d226fc68faede74b7e590478c4ac54df5c17758485de88db10",
    "vfxAudio": "sha256:3f2a1778bf35e051d0a4514c5febbbf33150223285371c2d276051af92338a0f",
    "qa": "sha256:e4762bf191c75cca82294d3ab10001927a99a5dfe311dc8eff716212609c0de2"
  },
  "policies": {
    "terrainReplacePolicy": "generated_namespace_only",
    "allowArbitrarySource": false,
    "allowDirectAssetIds": false,
    "generatedOnlyMutation": true
  },
  "budgets": {
    "limits": {
      "instances": 6000,
      "baseParts": 3500,
      "uniqueMeshIds": 150,
      "uniqueTextureIds": 220,
      "shadowCastingLights": 8,
      "activeParticleEmittersNearPlayer": 24,
      "particlesPerSecondNearPlayer": 350,
      "transparentOverlapLayers": 4,
      "clientFrameTargetFps": 30
    },
    "planned": {
      "terrainOperations": 3,
      "instances": 11,
      "localLights": 2,
      "markerBindings": 4,
      "activeParticleEmittersNearPlayer": 12,
      "particlesPerSecondNearPlayer": 180,
      "transparentOverlapLayers": 3
    }
  },
  "operations": [
    {
      "sequence": 1,
      "operationId": "folder_structures",
      "action": "ensure_folder",
      "target": "Workspace.Generated.world01-shadow-forest-golden.Structures",
      "payload": {
        "folderName": "Structures"
      }
    },
    {
      "sequence": 2,
      "operationId": "folder_props",
      "action": "ensure_folder",
      "target": "Workspace.Generated.world01-shadow-forest-golden.Props",
      "payload": {
        "folderName": "Props"
      }
    },
    {
      "sequence": 3,
      "operationId": "folder_lightingprops",
      "action": "ensure_folder",
      "target": "Workspace.Generated.world01-shadow-forest-golden.LightingProps",
      "payload": {
        "folderName": "LightingProps"
      }
    },
    {
      "sequence": 4,
      "operationId": "folder_gameplay",
      "action": "ensure_folder",
      "target": "Workspace.Generated.world01-shadow-forest-golden.Gameplay",
      "payload": {
        "folderName": "Gameplay"
      }
    },
    {
      "sequence": 5,
      "operationId": "terrain_terrain_base",
      "action": "terrain_fill",
      "target": "Workspace.Terrain",
      "payload": {
        "shape": "block",
        "materialToken": "ground_dark",
        "transform": {
          "position": [
            0,
            -4,
            0
          ],
          "orientationDegrees": [
            0,
            0,
            0
          ]
        },
        "size": [
          256,
          8,
          256
        ],
        "scope": {
          "min": [
            -128,
            -16,
            -128
          ],
          "max": [
            128,
            80,
            128
          ]
        },
        "buildNamespace": "Workspace.Generated.world01-shadow-forest-golden"
      }
    },
    {
      "sequence": 6,
      "operationId": "terrain_terrain_spawn_pad",
      "action": "terrain_fill",
      "target": "Workspace.Terrain",
      "payload": {
        "shape": "block",
        "materialToken": "stone_moonlit",
        "transform": {
          "position": [
            0,
            -1,
            -96
          ],
          "orientationDegrees": [
            0,
            0,
            0
          ]
        },
        "size": [
          100,
          2,
          48
        ],
        "scope": {
          "min": [
            -128,
            -16,
            -128
          ],
          "max": [
            128,
            80,
            128
          ]
        },
        "buildNamespace": "Workspace.Generated.world01-shadow-forest-golden"
      }
    },
    {
      "sequence": 7,
      "operationId": "terrain_terrain_boss_pad",
      "action": "terrain_fill",
      "target": "Workspace.Terrain",
      "payload": {
        "shape": "cylinder",
        "materialToken": "stone_corrupted",
        "transform": {
          "position": [
            0,
            -1,
            78
          ],
          "orientationDegrees": [
            0,
            0,
            90
          ]
        },
        "size": [
          100,
          2,
          100
        ],
        "scope": {
          "min": [
            -128,
            -16,
            -128
          ],
          "max": [
            128,
            80,
            128
          ]
        },
        "buildNamespace": "Workspace.Generated.world01-shadow-forest-golden"
      }
    },
    {
      "sequence": 8,
      "operationId": "instance_floor_spawn",
      "action": "create_primitive",
      "target": "Workspace.Generated.world01-shadow-forest-golden.Structures.floor_spawn",
      "payload": {
        "className": "Part",
        "parentCategory": "Structures",
        "size": [
          100,
          2,
          48
        ],
        "transform": {
          "position": [
            0,
            -1,
            -96
          ],
          "orientationDegrees": [
            0,
            0,
            0
          ]
        },
        "materialToken": "stone_moonlit",
        "colorToken": "moon_blue",
        "anchored": true,
        "canCollide": true,
        "canTouch": false,
        "canQuery": true,
        "castShadow": true,
        "tags": [
          "generated",
          "foundation"
        ]
      }
    },
    {
      "sequence": 9,
      "operationId": "instance_floor_farm",
      "action": "create_primitive",
      "target": "Workspace.Generated.world01-shadow-forest-golden.Structures.floor_farm",
      "payload": {
        "className": "Part",
        "parentCategory": "Structures",
        "size": [
          120,
          2,
          92
        ],
        "transform": {
          "position": [
            0,
            -1,
            -26
          ],
          "orientationDegrees": [
            0,
            0,
            0
          ]
        },
        "materialToken": "ground_dark",
        "colorToken": "shadow_black",
        "anchored": true,
        "canCollide": true,
        "canTouch": false,
        "canQuery": true,
        "castShadow": true,
        "tags": [
          "generated",
          "foundation"
        ]
      }
    },
    {
      "sequence": 10,
      "operationId": "instance_floor_miniboss",
      "action": "create_primitive",
      "target": "Workspace.Generated.world01-shadow-forest-golden.Structures.floor_miniboss",
      "payload": {
        "className": "Part",
        "parentCategory": "Structures",
        "size": [
          90,
          2,
          30
        ],
        "transform": {
          "position": [
            0,
            -1,
            35
          ],
          "orientationDegrees": [
            0,
            0,
            0
          ]
        },
        "materialToken": "stone_corrupted",
        "colorToken": "shadow_black",
        "anchored": true,
        "canCollide": true,
        "canTouch": false,
        "canQuery": true,
        "castShadow": true,
        "tags": [
          "generated",
          "foundation"
        ]
      }
    },
    {
      "sequence": 11,
      "operationId": "instance_floor_boss",
      "action": "create_primitive",
      "target": "Workspace.Generated.world01-shadow-forest-golden.Structures.floor_boss",
      "payload": {
        "className": "Part",
        "parentCategory": "Structures",
        "size": [
          100,
          2,
          55
        ],
        "transform": {
          "position": [
            0,
            -1,
            77.5
          ],
          "orientationDegrees": [
            0,
            0,
            0
          ]
        },
        "materialToken": "stone_corrupted",
        "colorToken": "shadow_black",
        "anchored": true,
        "canCollide": true,
        "canTouch": false,
        "canQuery": true,
        "castShadow": true,
        "tags": [
          "generated",
          "foundation"
        ]
      }
    },
    {
      "sequence": 12,
      "operationId": "instance_floor_gate",
      "action": "create_primitive",
      "target": "Workspace.Generated.world01-shadow-forest-golden.Structures.floor_gate",
      "payload": {
        "className": "Part",
        "parentCategory": "Structures",
        "size": [
          50,
          2,
          23
        ],
        "transform": {
          "position": [
            0,
            -1,
            116.5
          ],
          "orientationDegrees": [
            0,
            0,
            0
          ]
        },
        "materialToken": "stone_moonlit",
        "colorToken": "moon_blue",
        "anchored": true,
        "canCollide": true,
        "canTouch": false,
        "canQuery": true,
        "castShadow": true,
        "tags": [
          "generated",
          "foundation"
        ]
      }
    },
    {
      "sequence": 13,
      "operationId": "instance_upgrade_altar",
      "action": "create_primitive",
      "target": "Workspace.Generated.world01-shadow-forest-golden.Gameplay.upgrade_altar",
      "payload": {
        "className": "Part",
        "parentCategory": "Gameplay",
        "size": [
          8,
          4,
          8
        ],
        "transform": {
          "position": [
            -20,